{
  "version": 1,
  "genere": "2026-10-16T16:21:04Z",
  "commune": 5540,
  "objets": [
    {
      "cle": "vd/22_INT_34",
      "numero": "22_INT_34",
      "type": "Interpellation",
      "depose": "2022-03-01",
      "titre": "Hausse de la cadence du LEB, un cadeau empoisonné pour la commune de Romanel ?",
      "auteurs": [
        {
          "nom": "Yann Glayre",
          "parti": "UDC"
        }
      ],
      "nombre_auteurs": 1,
      "statut": {
        "libelle": "Adopté",
        "date": "2023-04-05"
      },
      "derniere_etape": "2023-04-05",
      "communes": [
        {
          "ofs": 5518,
          "origine": "document"
        },
        {
          "ofs": 5592,
          "origine": "document"
        },
        {
          "ofs": 5589,
          "origine": "document"
        },
        {
          "ofs": 5582,
          "origine": "document"
        },
        {
          "ofs": 5586,
          "origine": "document"
        },
        {
          "ofs": 5585,
          "origine": "document"
        },
        {
          "ofs": 5521,
          "origine": "document"
        },
        {
          "ofs": 5540,
          "origine": "document"
        }
      ]
    },
    {
      "cle": "vd/21_LEG_77",
      "numero": "21_LEG_77",
      "type": "Décret/Loi",
      "depose": "2021-12-07",
      "titre": "EMPD Exposé des motifs et projet de décret accordant au Conseil d'Etat un crédit-cadre de CHF 5'979'000.- pour financer les travaux de rénovation de 5 cures propriété de l’Etat de Vaud",
      "auteurs": [
        {
          "nom": "Céline Baux",
          "parti": "UDC"
        }
      ],
      "nombre_auteurs": 1,
      "statut": {
        "libelle": "Adopté",
        "date": "2021-12-07"
      },
      "derniere_etape": "2021-12-07",
      "communes": [
        {
          "ofs": 5425,
          "origine": "document"
        },
        {
          "ofs": 5540,
          "origine": "document"
        },
        {
          "ofs": 5761,
          "origine": "document"
        },
        {
          "ofs": 5843,
          "origine": "document"
        },
        {
          "ofs": 5653,
          "origine": "document"
        }
      ]
    },
    {
      "cle": "vd/18_LEG_53",
      "numero": "18_LEG_53",
      "type": "Décret/Loi",
      "depose": "2018-11-06",
      "titre": "Exposé des motifs et projet de loi sur les ressources naturelles du sous-sol (LRNSS) et Rapport du Conseil d'Etat au Grand Conseil sur la motion Raphaël Mahaim et consorts \"Motion du groupe des verts en faveur de la géothermie : pour voir loin, il faut creuser profond !\"",
      "auteurs": [
        {
          "nom": "Jean-François Chapuisat",
          "parti": "V'L"
        },
        {
          "nom": "Jean-François Chapuisat",
          "parti": null
        }
      ],
      "nombre_auteurs": 3,
      "statut": {
        "libelle": "Adopté",
        "date": "2018-12-11"
      },
      "derniere_etape": "2018-12-11",
      "communes": [
        {
          "ofs": 5408,
          "origine": "document"
        },
        {
          "ofs": 5501,
          "origine": "document"
        },
        {
          "ofs": 5402,
          "origine": "document"
        },
        {
          "ofs": 5540,
          "origine": "document"
        }
      ]
    },
    {
      "cle": "vd/15_MOT_071",
      "numero": "15_MOT_071",
      "type": "Motion",
      "depose": "2015-09-01",
      "titre": "Stop aux recherches d'hydrocarbures",
      "auteurs": [
        {
          "nom": "Fabienne Despot",
          "parti": null
        },
        {
          "nom": "Fabienne Despot",
          "parti": "UDC"
        }
      ],
      "nombre_auteurs": 2,
      "statut": {
        "libelle": "Renvoyée au Conseil d'Etat",
        "date": "2016-02-09"
      },
      "derniere_etape": "2016-02-09",
      "communes": [
        {
          "ofs": 5408,
          "origine": "document"
        },
        {
          "ofs": 5501,
          "origine": "document"
        },
        {
          "ofs": 5540,
          "origine": "document"
        },
        {
          "ofs": 5693,
          "origine": "document"
        },
        {
          "ofs": 5586,
          "origine": "document"
        },
        {
          "ofs": 5539,
          "origine": "document"
        }
      ]
    },
    {
      "cle": "vd/14_INT_303",
      "numero": "14_INT_303",
      "type": "Interpellation",
      "depose": "2014-10-28",
      "titre": "Gaz, moratoire ou passoire ?",
      "auteurs": [
        {
          "nom": "Michel Collet",
          "parti": null
        },
        {
          "nom": "Michel Collet",
          "parti": "VER"
        }
      ],
      "nombre_auteurs": 2,
      "statut": {
        "libelle": "Traité",
        "date": "2015-04-21"
      },
      "derniere_etape": "2015-04-21",
      "communes": [
        {
          "ofs": 5408,
          "origine": "document"
        },
        {
          "ofs": 5693,
          "origine": "document"
        },
        {
          "ofs": 5540,
          "origine": "document"
        },
        {
          "ofs": 5501,
          "origine": "document"
        }
      ]
    },
    {
      "cle": "vd/10_LEG_318",
      "numero": "10_LEG_318",
      "type": "Décret/Loi",
      "depose": "2010-10-12",
      "titre": "Exposé des motifs et projet de décret sur la fusion des communes de Montaubion-Chardonney, Peney-le-Jorat, Sottens, Villars-Mendraz et Villars-Tiercelin (Jorat-Menthue)",
      "auteurs": [
        {
          "nom": "Vassilis Venizelos",
          "parti": "VER"
        },
        {
          "nom": "Vassilis Venizelos",
          "parti": null
        }
      ],
      "nombre_auteurs": 3,
      "statut": {
        "libelle": "Adopté",
        "date": "2010-10-12"
      },
      "derniere_etape": "2010-10-12",
      "communes": [
        {
          "ofs": 5804,
          "origine": "titre"
        },
        {
          "ofs": 5938,
          "origine": "document"
        },
        {
          "ofs": 5540,
          "origine": "document"
        },
        {
          "ofs": 5805,
          "origine": "document"
        },
        {
          "ofs": 5586,
          "origine": "document"
        },
        {
          "ofs": 5693,
          "origine": "document"
        },
        {
          "ofs": 5678,
          "origine": "document"
        },
        {
          "ofs": 5606,
          "origine": "document"
        },
        {
          "ofs": 5533,
          "origine": "document"
        },
        {
          "ofs": 5541,
          "origine": "document"
        }
      ]
    },
    {
      "cle": "vd/10_LEG_292",
      "numero": "10_LEG_292",
      "type": "Décret/Loi",
      "depose": "2010-10-12",
      "titre": "Exposé des motifs et projet de décret sur la fusion des communes de Dommartin, Naz, Poliez-le-Grand et Sugnens (Montilliez)",
      "auteurs": [
        {
          "nom": "Béatrice Métraux",
          "parti": null
        },
        {
          "nom": "Béatrice Métraux",
          "parti": "VER"
        }
      ],
      "nombre_auteurs": 2,
      "statut": {
        "libelle": "Adopté",
        "date": "2010-10-12"
      },
      "derniere_etape": "2010-10-12",
      "communes": [
        {
          "ofs": 5540,
          "origine": "titre"
        },
        {
          "ofs": 5586,
          "origine": "document"
        },
        {
          "ofs": 5533,
          "origine": "document"
        },
        {
          "ofs": 5514,
          "origine": "document"
        },
        {
          "ofs": 5804,
          "origine": "document"
        },
        {
          "ofs": 5693,
          "origine": "document"
        }
      ]
    }
  ]
}
