{
  "version": 1,
  "genere": "2026-10-16T16:21:04Z",
  "commune": 5914,
  "objets": [
    {
      "cle": "vd/23_LEG_185",
      "numero": "23_LEG_185",
      "type": "Décret/Loi",
      "depose": "2024-03-05",
      "titre": "EMPD EMPD accordant au Conseil d'Etat un crédit cadre de CHF 15’500'000.- pour financer des travaux d’entretien de huit tronçons de routes cantonales situés sur les RC 1 entre la jonction autoroutière de Malley et le giratoire de Dorigny, RC 78 entre Bremblens et Bussigny, RC 79/76 entre Bussigny giratoire de Poimboeuf et le carrefour l’Ile à Brizet, RC 179 entre la jonction autoroutière de Crissier et le carrefour de Buyère, RC 303/313 entre Sullens et Bettens/Bioley-Orjulaz, RC 546 entre Bois d’Archan et Froideville, RC 290 entre Ependes et Mathod ainsi que la RC 618 entre Curtilles et Lucens",
      "auteurs": [
        {
          "nom": "Pierre-Alain Favrod",
          "parti": "UDC"
        }
      ],
      "nombre_auteurs": 1,
      "statut": {
        "libelle": "Adopté",
        "date": "2024-03-05"
      },
      "derniere_etape": "2024-03-05",
      "communes": [
        {
          "ofs": 5622,
          "origine": "titre"
        },
        {
          "ofs": 5624,
          "origine": "titre"
        },
        {
          "ofs": 5583,
          "origine": "titre"
        },
        {
          "ofs": 5501,
          "origine": "titre"
        },
        {
          "ofs": 5471,
          "origine": "titre"
        },
        {
          "ofs": 5511,
          "origine": "titre"
        },
        {
          "ofs": 5523,
          "origine": "titre"
        },
        {
          "ofs": 5914,
          "origine": "titre"
        },
        {
          "ofs": 5919,
          "origine": "titre"
        },
        {
          "ofs": 5669,
          "origine": "titre"
        },
        {
          "ofs": 5675,
          "origine": "titre"
        }
      ]
    },
    {
      "cle": "vd/20_LEG_160",
      "numero": "20_LEG_160",
      "type": "Décret/Loi",
      "depose": "2020-02-04",
      "titre": "Exposé des motifs et projet de décret accordant au Conseil d'Etat un crédit additionnel de CHF 3'400'000.- au décret de CHF 13'700'000.- du 10 janvier 2012 pour financer le renforcement et l'assainissement du solde des ouvrages non conformes au trafic 40 t du réseau routier cantonal",
      "auteurs": [
        {
          "nom": "Jean-François Thuillard",
          "parti": "UDC"
        },
        {
          "nom": "Jean-François Thuillard",
          "parti": null
        }
      ],
      "nombre_auteurs": 3,
      "statut": {
        "libelle": "Adopté",
        "date": "2020-02-04"
      },
      "derniere_etape": "2020-02-04",
      "communes": [
        {
          "ofs": 5938,
          "origine": "document"
        },
        {
          "ofs": 5919,
          "origine": "document"
        },
        {
          "ofs": 5757,
          "origine": "document"
        },
        {
          "ofs": 5914,
          "origine": "document"
        },
        {
          "ofs": 5930,
          "origine": "document"
        },
        {
          "ofs": 5749,
          "origine": "document"
        },
        {
          "ofs": 5798,
          "origine": "document"
        },
        {
          "ofs": 5586,
          "origine": "document"
        }
      ]
    },
    {
      "cle": "vd/19_LEG_160",
      "numero": "19_LEG_160",
      "type": "Décret/Loi",
      "depose": "2019-08-21",
      "titre": "EMPD accordant au CE un crédit additionnel de CHF 3'400'000.- pour financer le renforcement du solde des ouvrages non conformes au trafic 40 t",
      "auteurs": [],
      "nombre_auteurs": 0,
      "statut": {
        "libelle": "Eingereicht",
        "date": "2019-08-21"
      },
      "derniere_etape": "2019-08-21",
      "communes": [
        {
          "ofs": 5938,
          "origine": "document"
        },
        {
          "ofs": 5757,
          "origine": "document"
        },
        {
          "ofs": 5919,
          "origine": "document"
        },
        {
          "ofs": 5930,
          "origine": "document"
        },
        {
          "ofs": 5914,
          "origine": "document"
        },
        {
          "ofs": 5749,
          "origine": "document"
        },
        {
          "ofs": 5798,
          "origine": "document"
        }
      ]
    },
    {
      "cle": "vd/14_INT_251",
      "numero": "14_INT_251",
      "type": "Interpellation",
      "depose": "2014-04-29",
      "titre": "Informatique à l'école : fracture ou révolution numérique ?",
      "auteurs": [
        {
          "nom": "Alexandre Rydlo",
          "parti": "SOC"
        },
        {
          "nom": "Alexandre Rydlo",
          "parti": null
        }
      ],
      "nombre_auteurs": 2,
      "statut": {
        "libelle": "Traité",
        "date": "2014-11-11"
      },
      "derniere_etape": "2014-11-11",
      "communes": [
        {
          "ofs": 5765,
          "origine": "document"
        },
        {
          "ofs": 5914,
          "origine": "document"
        }
      ]
    }
  ]
}
