{
  "version": 1,
  "genere": "2026-10-16T16:21:04Z",
  "commune": 5560,
  "objets": [
    {
      "cle": "vd/21_INT_90",
      "numero": "21_INT_90",
      "type": "Interpellation",
      "depose": "2021-06-23",
      "titre": "Il faut fermer la place de tir de Vugelles-la-Mothe",
      "auteurs": [
        {
          "nom": "Vassilis Venizelos",
          "parti": "VER"
        }
      ],
      "nombre_auteurs": 1,
      "statut": {
        "libelle": "Adopté",
        "date": "2021-12-08"
      },
      "derniere_etape": "2021-12-08",
      "communes": [
        {
          "ofs": 5904,
          "origine": "document"
        },
        {
          "ofs": 5678,
          "origine": "document"
        },
        {
          "ofs": 5401,
          "origine": "document"
        },
        {
          "ofs": 5924,
          "origine": "document"
        },
        {
          "ofs": 5552,
          "origine": "document"
        },
        {
          "ofs": 5560,
          "origine": "document"
        },
        {
          "ofs": 5564,
          "origine": "document"
        },
        {
          "ofs": 5634,
          "origine": "document"
        }
      ]
    },
    {
      "cle": "vd/18_PET_023",
      "numero": "18_PET_023",
      "type": "Pétition",
      "depose": "2018-10-02",
      "titre": "Pétition Sauvez Chasseron - Creux-du-Van",
      "auteurs": [],
      "nombre_auteurs": 0,
      "statut": {
        "libelle": "Refusé",
        "date": "2019-06-04"
      },
      "derniere_etape": "2019-06-04",
      "communes": [
        {
          "ofs": 5560,
          "origine": "document"
        },
        {
          "ofs": 5566,
          "origine": "document"
        },
        {
          "ofs": 5556,
          "origine": "document"
        },
        {
          "ofs": 5552,
          "origine": "document"
        },
        {
          "ofs": 5557,
          "origine": "document"
        },
        {
          "ofs": 5562,
          "origine": "document"
        },
        {
          "ofs": 5571,
          "origine": "document"
        },
        {
          "ofs": 5551,
          "origine": "document"
        },
        {
          "ofs": 5554,
          "origine": "document"
        }
      ]
    },
    {
      "cle": "vd/16_RES_039",
      "numero": "16_RES_039",
      "type": "Résolution",
      "depose": "2016-12-14",
      "titre": "Projets éoliens vaudois : les blocages de l'armée méritent des éclaircissements",
      "auteurs": [
        {
          "nom": "Vassilis Venizelos",
          "parti": "VER"
        }
      ],
      "nombre_auteurs": 1,
      "statut": {
        "libelle": "Traité",
        "date": "2016-12-20"
      },
      "derniere_etape": "2016-12-20",
      "communes": [
        {
          "ofs": 5822,
          "origine": "document"
        },
        {
          "ofs": 5566,
          "origine": "document"
        },
        {
          "ofs": 5560,
          "origine": "document"
        },
        {
          "ofs": 5514,
          "origine": "document"
        },
        {
          "ofs": 5665,
          "origine": "document"
        }
      ]
    }
  ]
}
