{
  "version": 1,
  "genere": "2026-10-16T16:21:04Z",
  "commune": 5799,
  "objets": [
    {
      "cle": "vd/24_INT_63",
      "numero": "24_INT_63",
      "type": "Interpellation",
      "depose": "2024-03-19",
      "titre": "Transports publics du Jorat repris par CarPostal : quel bilan ?",
      "auteurs": [
        {
          "nom": "Loïc Bardet",
          "parti": "PLR"
        }
      ],
      "nombre_auteurs": 1,
      "statut": {
        "libelle": "Adopté",
        "date": "2024-09-11"
      },
      "derniere_etape": "2024-09-11",
      "communes": [
        {
          "ofs": 5678,
          "origine": "document"
        },
        {
          "ofs": 5806,
          "origine": "document"
        },
        {
          "ofs": 5586,
          "origine": "document"
        },
        {
          "ofs": 5799,
          "origine": "document"
        }
      ]
    },
    {
      "cle": "vd/19_POS_149",
      "numero": "19_POS_149",
      "type": "Postulat",
      "depose": "2019-06-04",
      "titre": "Création artistique, résidences et répétitions : quel est l'état des lieux ?",
      "auteurs": [
        {
          "nom": "Sarah Neumann",
          "parti": "SOC"
        },
        {
          "nom": "Claude Matter",
          "parti": "PLR"
        }
      ],
      "nombre_auteurs": 2,
      "statut": {
        "libelle": "Pris en considération",
        "date": "2022-10-12"
      },
      "derniere_etape": "2022-10-12",
      "communes": [
        {
          "ofs": 5586,
          "origine": "document"
        },
        {
          "ofs": 5761,
          "origine": "document"
        },
        {
          "ofs": 5890,
          "origine": "document"
        },
        {
          "ofs": 5889,
          "origine": "document"
        },
        {
          "ofs": 5637,
          "origine": "document"
        },
        {
          "ofs": 5799,
          "origine": "document"
        },
        {
          "ofs": 5886,
          "origine": "document"
        },
        {
          "ofs": 5938,
          "origine": "document"
        },
        {
          "ofs": 5590,
          "origine": "document"
        }
      ]
    },
    {
      "cle": "vd/19_LEG_195",
      "numero": "19_LEG_195",
      "type": "Décret/Loi",
      "depose": "2019-12-18",
      "titre": "EMPD accordant au Conseil d'Etat un crédit d'ouvrage de CHF 2'120'000 pour financer l'assainissement des RC 751-IL-S et 752-IL-S entre Maracon et La Rogivue et la création d'un passage à batraciens",
      "auteurs": [],
      "nombre_auteurs": 0,
      "statut": {
        "libelle": "Eingereicht",
        "date": "2019-12-18"
      },
      "derniere_etape": "2019-12-18",
      "communes": [
        {
          "ofs": 5790,
          "origine": "titre"
        },
        {
          "ofs": 5805,
          "origine": "document"
        },
        {
          "ofs": 5428,
          "origine": "document"
        },
        {
          "ofs": 5890,
          "origine": "document"
        },
        {
          "ofs": 5799,
          "origine": "document"
        }
      ]
    },
    {
      "cle": "vd/17_PET_070",
      "numero": "17_PET_070",
      "type": "Pétition",
      "depose": "2017-05-30",
      "titre": "Pétition pour la renaturation du ruisseau « Le Flon de Carrouge » à Servion",
      "auteurs": [],
      "nombre_auteurs": 0,
      "statut": {
        "libelle": "Refusé",
        "date": "2018-03-13"
      },
      "derniere_etape": "2018-03-13",
      "communes": [
        {
          "ofs": 5806,
          "origine": "titre"
        },
        {
          "ofs": 5799,
          "origine": "titre"
        }
      ]
    },
    {
      "cle": "vd/13_PET_013",
      "numero": "13_PET_013",
      "type": "Pétition",
      "depose": "2013-11-26",
      "titre": "Pétition pour une décision obsolète",
      "auteurs": [],
      "nombre_auteurs": 0,
      "statut": {
        "libelle": "Refusé",
        "date": "2013-12-17"
      },
      "derniere_etape": "2013-12-17",
      "communes": [
        {
          "ofs": 5799,
          "origine": "document"
        }
      ]
    },
    {
      "cle": "vd/13_PET_009",
      "numero": "13_PET_009",
      "type": "Pétition",
      "depose": "2013-11-26",
      "titre": "Pétition sur les estimations illégales",
      "auteurs": [],
      "nombre_auteurs": 0,
      "statut": {
        "libelle": "Refusé",
        "date": "2013-12-17"
      },
      "derniere_etape": "2013-12-17",
      "communes": [
        {
          "ofs": 5799,
          "origine": "document"
        },
        {
          "ofs": 5646,
          "origine": "document"
        },
        {
          "ofs": 5938,
          "origine": "document"
        }
      ]
    },
    {
      "cle": "vd/11_PET_081",
      "numero": "11_PET_081",
      "type": "Pétition",
      "depose": "2012-05-29",
      "titre": "Pétition pour un droit à l'égalité de traitement",
      "auteurs": [],
      "nombre_auteurs": 0,
      "statut": {
        "libelle": "Refusé",
        "date": "2012-09-11"
      },
      "derniere_etape": "2012-09-11",
      "communes": [
        {
          "ofs": 5799,
          "origine": "document"
        }
      ]
    },
    {
      "cle": "vd/11_LEG_364",
      "numero": "11_LEG_364",
      "type": "Décret/Loi",
      "depose": "2011-04-05",
      "titre": "Exposé des motifs et projet de décret sur la fusion des communes de Servion et Les Cullayes (Servion)",
      "auteurs": [
        {
          "nom": "Eric Sonnay",
          "parti": null
        },
        {
          "nom": "Eric Sonnay",
          "parti": "PLR"
        }
      ],
      "nombre_auteurs": 3,
      "statut": {
        "libelle": "Adopté",
        "date": "2011-04-05"
      },
      "derniere_etape": "2011-04-05",
      "communes": [
        {
          "ofs": 5799,
          "origine": "titre"
        },
        {
          "ofs": 5805,
          "origine": "document"
        },
        {
          "ofs": 5806,
          "origine": "document"
        },
        {
          "ofs": 5586,
          "origine": "document"
        },
        {
          "ofs": 5803,
          "origine": "document"
        },
        {
          "ofs": 5792,
          "origine": "document"
        },
        {
          "ofs": 5693,
          "origine": "document"
        },
        {
          "ofs": 5678,
          "origine": "document"
        },
        {
          "ofs": 5790,
          "origine": "document"
        }
      ]
    }
  ]
}
